{
  "schema_version": "1.0",
  "asset_id": "vehicle.canoe",
  "asset_version": "0.1.0",
  "display_name": "单桨木舟 / Canoe",
  "aliases": [
    "canoe",
    "单桨木舟"
  ],
  "browse_group": "vehicles",
  "semantic_type": "vehicle.paddled_boat",
  "semantic_subtypes": [],
  "morphology": {
    "architecture": "rigid_articulated",
    "profiles": [],
    "appendages": [],
    "stance": "horizontal"
  },
  "scale": {
    "units": "meter",
    "up_axis": "Y",
    "forward_axis": "unknown",
    "dimensions_m": null,
    "source_transform": {
      "positionMetersXYZ": [
        0,
        0,
        0
      ],
      "rotationEulerRadiansXYZ": [
        0,
        0,
        0
      ],
      "scaleXYZ": [
        1,
        1,
        1
      ]
    }
  },
  "lifecycle": "assets_ready",
  "placeholder": false,
  "description": "Four-sample hydrostatic buoyancy and stroke-driven drag approximation; no waves, current or capsize simulation. W repeats single-sided strokes with yaw, S back-paddles, A/D change sides and sweep, Space braces to slow; propulsion requires immersion.",
  "default_assembly": "subjects/vehicles/vehicle.canoe/0.1.0/assemblies/default.json",
  "dependencies": []
}
