{
  "schema_version": "1.0",
  "asset_id": "vehicle.trainer-plane",
  "asset_version": "0.1.0",
  "display_name": "稳定教练机 / Trainer airplane",
  "aliases": [
    "trainer-plane",
    "稳定教练机"
  ],
  "browse_group": "vehicles",
  "semantic_type": "vehicle.plane",
  "semantic_subtypes": [],
  "morphology": {
    "architecture": "rigid_articulated",
    "profiles": [],
    "appendages": [],
    "stance": "horizontal"
  },
  "scale": {
    "units": "meter",
    "up_axis": "Y",
    "forward_axis": "unknown",
    "dimensions_m": null,
    "source_transform": {
      "positionMetersXYZ": [
        0,
        0,
        0
      ],
      "rotationEulerRadiansXYZ": [
        0,
        0,
        0
      ],
      "scaleXYZ": [
        1,
        1,
        1
      ]
    }
  },
  "lifecycle": "assets_ready",
  "placeholder": false,
  "description": "已从 whitebox 登记资源复制，保留原字节。",
  "default_assembly": "subjects/vehicles/vehicle.trainer-plane/0.1.0/assemblies/default.json",
  "dependencies": []
}
