{
  "schema_version": "1.0",
  "asset_id": "animal.tyannosaurus-rex-sue-rd",
  "asset_version": "0.1.0",
  "display_name": "霸王龙 · 待入库",
  "aliases": [
    "Tyannosaurus_Rex_Sue_RD"
  ],
  "browse_group": "animals",
  "semantic_type": "animal.dinosaur.biped",
  "semantic_subtypes": [
    "dinosaur/biped"
  ],
  "morphology": {
    "architecture": "unknown",
    "profiles": [],
    "appendages": [],
    "stance": "unknown"
  },
  "scale": {
    "units": "unknown",
    "up_axis": "unknown",
    "forward_axis": "unknown",
    "dimensions_m": null,
    "source_transform": null
  },
  "lifecycle": "placeholder",
  "placeholder": true,
  "description": "来源资料占位，待导出完整 GLB、绑定骨架与动作。",
  "default_assembly": "subjects/animals/animal.tyannosaurus-rex-sue-rd/0.1.0/assemblies/default.json",
  "dependencies": []
}
