{
  "schema_version": "1.0",
  "asset_id": "vehicle.atv",
  "asset_version": "0.1.0",
  "display_name": "全地形车 / All-terrain vehicle",
  "aliases": [
    "atv",
    "全地形车"
  ],
  "browse_group": "vehicles",
  "semantic_type": "vehicle.wheeled",
  "semantic_subtypes": [],
  "morphology": {
    "architecture": "rigid_articulated",
    "profiles": [],
    "appendages": [],
    "stance": "horizontal"
  },
  "scale": {
    "units": "meter",
    "up_axis": "Y",
    "forward_axis": "unknown",
    "dimensions_m": null,
    "source_transform": {
      "positionMetersXYZ": [
        0,
        0,
        0
      ],
      "rotationEulerRadiansXYZ": [
        0,
        0,
        0
      ],
      "scaleXYZ": [
        1,
        1,
        1
      ]
    }
  },
  "lifecycle": "assets_ready",
  "placeholder": false,
  "description": "Racing quad inspired by PUBG; short-wheelbase four-wheel drive with front-wheel steering and original straddle rider. Single active driver under the current Training contract. Rear passenger socket is reserved; no fuel, damage or multiplayer passenger simulation.",
  "default_assembly": "subjects/vehicles/vehicle.atv/0.1.0/assemblies/default.json",
  "dependencies": []
}
