{
  "schema_version": "1.0",
  "asset_id": "animal.crocodile",
  "asset_version": "0.1.0",
  "display_name": "鳄鱼 · 待入库",
  "aliases": [
    "CROCODILE"
  ],
  "browse_group": "animals",
  "semantic_type": "animal.quadruped.reptile",
  "semantic_subtypes": [
    "quadruped/reptile"
  ],
  "morphology": {
    "architecture": "unknown",
    "profiles": [
      "quadruped"
    ],
    "appendages": [],
    "stance": "unknown"
  },
  "scale": {
    "units": "unknown",
    "up_axis": "unknown",
    "forward_axis": "unknown",
    "dimensions_m": null,
    "source_transform": null
  },
  "lifecycle": "placeholder",
  "placeholder": true,
  "description": "来源资料占位，待导出完整 GLB、绑定骨架与动作。",
  "default_assembly": "subjects/animals/animal.crocodile/0.1.0/assemblies/default.json",
  "dependencies": []
}
